{
	"id": "review_01HXYZEXAMPLE",
	"sourceDecisionId": "connect.dec_01HXYZEXAMPLE",
	"objective": "Align Connect adapter artifacts with existing runtime surfaces",
	"reason": "Protected-path config changes plus review-required Connect threshold updates",
	"summary": {
		"paths": [
			"packages/libs/contracts-spec/src/workspace-config/contractsrc-schema.ts",
			"specs/contractspec-connect-spec/schemas/patch-verdict.schema.json"
		],
		"impactedContracts": [
			{
				"key": "controlPlane.plan.verify",
				"version": "1.0.0",
				"kind": "command"
			},
			{
				"key": "controlPlane.policy.explain",
				"version": "1.0.0",
				"kind": "query"
			}
		],
		"affectedSurfaces": ["runtime", "cli", "audit"],
		"requiredChecks": ["path-boundary", "approval-routing", "targeted-tests"]
	},
	"evidence": [
		{
			"type": "context-pack",
			"ref": ".contractspec/connect/decisions/connect.dec_01HXYZEXAMPLE/context-pack.json"
		},
		{
			"type": "plan-packet",
			"ref": ".contractspec/connect/decisions/connect.dec_01HXYZEXAMPLE/plan-packet.json"
		},
		{
			"type": "patch-verdict",
			"ref": ".contractspec/connect/decisions/connect.dec_01HXYZEXAMPLE/patch-verdict.json"
		},
		{
			"type": "control-plane-trace",
			"ref": "controlPlane.trace.get?decisionId=cp_decision_01HXYZEXAMPLE"
		}
	],
	"requiredApprovals": [
		{
			"capability": "control-plane.execution.approve",
			"reason": "allow replay-safe continuation after protected-path review"
		}
	],
	"controlPlane": {
		"traceQuery": {
			"key": "controlPlane.trace.get",
			"version": "1.0.0",
			"kind": "query"
		},
		"policyExplain": {
			"key": "controlPlane.policy.explain",
			"version": "1.0.0",
			"kind": "query"
		},
		"decisionId": "cp_decision_01HXYZEXAMPLE",
		"approvalStatus": "pending",
		"traceId": "trace_01HXYZEXAMPLE"
	},
	"studio": {
		"enabled": false,
		"mode": "off"
	}
}
