{
  "id": "review_d1d34af9-8eea-4186-af27-6fc10f8f5860",
  "sourceDecisionId": "connect.dec_25a00de7-ada4-49a7-b823-906b785ccfc5",
  "objective": "Run bun run release:build",
  "reason": "Impact could not be resolved for .changeset/builder-next-wave-hardening.release.yaml.",
  "summary": {
    "paths": [
      ".changeset/builder-next-wave-hardening.release.yaml",
      ".changeset/builder-v3-control-plane-rollout.release.yaml",
      ".changeset/connect-spec-alignment-april-2026.release.yaml",
      ".changeset/docs-learning-path-spec-packs.release.yaml",
      ".github/workflows/dev-ci.yml",
      "CONTRIBUTING.md"
    ],
    "impactedContracts": [],
    "affectedSurfaces": [
      "audit",
      "runtime"
    ],
    "requiredChecks": []
  },
  "evidence": [
    {
      "type": "context-pack",
      "ref": ".contractspec/connect/decisions/connect.dec_25a00de7-ada4-49a7-b823-906b785ccfc5/context-pack.json"
    },
    {
      "type": "plan-packet",
      "ref": ".contractspec/connect/decisions/connect.dec_25a00de7-ada4-49a7-b823-906b785ccfc5/plan-packet.json"
    },
    {
      "type": "patch-verdict",
      "ref": ".contractspec/connect/decisions/connect.dec_25a00de7-ada4-49a7-b823-906b785ccfc5/patch-verdict.json"
    },
    {
      "type": "control-plane-trace",
      "ref": "controlPlane.trace.get?connectDecisionId=connect.dec_25a00de7-ada4-49a7-b823-906b785ccfc5"
    }
  ],
  "requiredApprovals": [
    {
      "capability": "controlPlane.execution.approve",
      "reason": "Impact could not be resolved for .changeset/builder-next-wave-hardening.release.yaml."
    }
  ],
  "controlPlane": {
    "traceQuery": {
      "key": "controlPlane.trace.get",
      "version": "1.0.0",
      "kind": "query"
    },
    "policyExplain": {
      "key": "controlPlane.policy.explain",
      "version": "1.0.0",
      "kind": "query"
    }
  },
  "studio": {
    "enabled": false,
    "mode": "off"
  }
}
